{

  "agent_id": "reviewer",

  "display_name": "Reviewer Agent",

  "preferred_model": null,

  "role": "reviewer",

  "enabled": true,

  "isolation_method": null,

  "parallel_safe": null,

  "integration_review_required": null,

  "capability_tags_subset": null,

  "allowed_skills_mcp_subset": [

    "citation-verifier",

    "academic-paper-review",

    "openalex-mcp",

    "semantic-scholar-mcp"

  ],

  "write_scope_subset": [

    "outputs/agent-runs/<run_id>/<agent_id>/"

  ],

  "max_execution_mode": "sequential_multi_agent_execution",

  "required_inputs": [

    "target_agent_result",

    "target_agent_summary"

  ],

  "expected_outputs": [

    "review.<target_agent_id>.md",

    "gate.<target_agent_id>.json"

  ],

  "review_gate": "target-specific"

}
